{
  "schema_version": "1.0", "source": "fixture", "skill_id": "incident-analysis",
  "harness": "fixture-harness", "model": "deterministic-fixture", "workspace_id": "examples/.infra-context", "scorer": "harness-skill-lift-v1",
  "pairs": [
    {
      "case_id": "explicit-dependency-saturation", "kind": "explicit",
      "baseline": {"run_id": "b-exp", "scores": {"security": 1, "skill_execution": 0, "skill_efficiency": 0.50, "accuracy": 0.55, "goal_accuracy": 0.50, "behavior_check": 0.40}, "usage": {"tokens": 9000, "tool_calls": 18, "duration_ms": 180000}, "loaded_skills": []},
      "treatment": {"run_id": "t-exp", "scores": {"security": 1, "skill_execution": 0.95, "skill_efficiency": 0.82, "accuracy": 0.90, "goal_accuracy": 0.90, "behavior_check": 0.92}, "usage": {"tokens": 6200, "tool_calls": 11, "duration_ms": 125000}, "loaded_skills": ["incident-analysis"]}
    },
    {
      "case_id": "implicit-latency-investigation", "kind": "implicit",
      "baseline": {"run_id": "b-imp", "scores": {"security": 0.98, "skill_execution": 0.10, "skill_efficiency": 0.45, "accuracy": 0.50, "goal_accuracy": 0.45, "behavior_check": 0.35}, "usage": {"tokens": 8500, "tool_calls": 17, "duration_ms": 170000}, "loaded_skills": []},
      "treatment": {"run_id": "t-imp", "scores": {"security": 1, "skill_execution": 0.90, "skill_efficiency": 0.75, "accuracy": 0.85, "goal_accuracy": 0.85, "behavior_check": 0.86}, "usage": {"tokens": 6500, "tool_calls": 12, "duration_ms": 130000}, "loaded_skills": ["incident-analysis"]}
    },
    {
      "case_id": "contextual-change-followup", "kind": "contextual",
      "baseline": {"run_id": "b-ctx", "scores": {"security": 1, "skill_execution": 0.05, "skill_efficiency": 0.42, "accuracy": 0.60, "goal_accuracy": 0.55, "behavior_check": 0.45}, "usage": {"tokens": 7800, "tool_calls": 15, "duration_ms": 155000}, "loaded_skills": []},
      "treatment": {"run_id": "t-ctx", "scores": {"security": 1, "skill_execution": 0.85, "skill_efficiency": 0.72, "accuracy": 0.85, "goal_accuracy": 0.82, "behavior_check": 0.84}, "usage": {"tokens": 6100, "tool_calls": 11, "duration_ms": 128000}, "loaded_skills": ["incident-analysis"]}
    },
    {
      "case_id": "negative-doc-edit", "kind": "negative",
      "baseline": {"run_id": "b-neg", "scores": {"security": 1, "skill_execution": 1, "skill_efficiency": 0.90, "accuracy": 0.95, "goal_accuracy": 0.95, "behavior_check": 0.95}, "usage": {"tokens": 1200, "tool_calls": 1, "duration_ms": 18000}, "loaded_skills": []},
      "treatment": {"run_id": "t-neg", "scores": {"security": 1, "skill_execution": 1, "skill_efficiency": 0.90, "accuracy": 0.95, "goal_accuracy": 0.95, "behavior_check": 0.95}, "usage": {"tokens": 1200, "tool_calls": 1, "duration_ms": 18000}, "loaded_skills": []}
    }
  ]
}
